{
  "$schema": "https://vinyaas.vercel.app/r/schema/registry-item.json",
  "name": "toggle-group",
  "type": "registry:ui",
  "description": "A set of toggles with single or multiple selection and joined or spaced layouts.",
  "dependencies": ["class-variance-authority", "clsx", "tailwind-merge"],
  "registryDependencies": ["toggle"],
  "files": [
    {
      "path": "ui/toggle-group/index.tsx",
      "content": "\"use client\";\n\nimport React, { createContext, useContext, useState } from \"react\";\n\nimport { cn } from \"@/lib/utils\";\nimport { toggleVariants } from \"../toggle\";\n\ntype ToggleGroupContextValue = {\n  value: readonly string[];\n  toggle: (itemValue: string) => void;\n  variant: \"default\" | \"outline\";\n  size: \"default\" | \"sm\" | \"lg\";\n  disabled: boolean;\n  multiple: boolean;\n};\n\nconst ToggleGroupContext = createContext<ToggleGroupContextValue | null>(null);\n\nfunction useToggleGroup() {\n  const context = useContext(ToggleGroupContext);\n\n  if (!context) {\n    throw new Error(\"ToggleGroupItem must render inside ToggleGroup.\");\n  }\n\n  return context;\n}\n\nexport type ToggleGroupProps = Omit<\n  React.ComponentProps<\"div\">,\n  \"defaultValue\" | \"onChange\"\n> & {\n  /** Allow several items pressed at once. Defaults to a single selection. */\n  multiple?: boolean;\n  /** Controlled pressed item values. */\n  value?: readonly string[];\n  /** Initial pressed item values when uncontrolled. */\n  defaultValue?: readonly string[];\n  onValueChange?: (value: string[]) => void;\n  variant?: \"default\" | \"outline\";\n  size?: \"default\" | \"sm\" | \"lg\";\n  /** Gap between items in 4px steps. 0 joins the items into one bar. */\n  spacing?: number;\n  orientation?: \"horizontal\" | \"vertical\";\n  disabled?: boolean;\n};\n\n/**\n * A set of toggles. Single mode (default) behaves like a segmented control\n * and lets the pressed item be turned off; `multiple` allows any combination.\n * Arrow keys move focus between items; every item stays in the Tab order.\n */\nexport function ToggleGroup({\n  multiple = false,\n  value,\n  defaultValue = [],\n  onValueChange,\n  variant = \"default\",\n  size = \"default\",\n  spacing = 0,\n  orientation = \"horizontal\",\n  disabled = false,\n  className,\n  style,\n  ref,\n  onKeyDown,\n  ...props\n}: ToggleGroupProps) {\n  const [uncontrolled, setUncontrolled] =\n    useState<readonly string[]>(defaultValue);\n  const current = value ?? uncontrolled;\n\n  function toggle(itemValue: string) {\n    const pressed = current.includes(itemValue);\n    let next: string[];\n\n    if (multiple) {\n      next = pressed\n        ? current.filter((entry) => entry !== itemValue)\n        : [...current, itemValue];\n    } else {\n      next = pressed ? [] : [itemValue];\n    }\n\n    if (value === undefined) {\n      setUncontrolled(next);\n    }\n\n    onValueChange?.(next);\n  }\n\n  return (\n    <ToggleGroupContext.Provider\n      value={{ value: current, toggle, variant, size, disabled, multiple }}\n    >\n      <div\n        {...props}\n        ref={ref}\n        role=\"group\"\n        data-slot=\"toggle-group\"\n        data-orientation={orientation}\n        data-spacing={spacing}\n        data-variant={variant}\n        style={{ gap: spacing * 4, ...style }}\n        className={cn(\n          \"flex w-fit items-center\",\n          orientation === \"vertical\" && \"flex-col items-stretch\",\n          // Joined bars share one border and only round the outer corners.\n          spacing === 0 &&\n            (orientation === \"horizontal\"\n              ? \"[&>[data-slot=toggle-group-item]]:rounded-none [&>[data-slot=toggle-group-item]:first-child]:rounded-s-md [&>[data-slot=toggle-group-item]:last-child]:rounded-e-md\"\n              : \"[&>[data-slot=toggle-group-item]]:rounded-none [&>[data-slot=toggle-group-item]:first-child]:rounded-t-md [&>[data-slot=toggle-group-item]:last-child]:rounded-b-md\"),\n          spacing === 0 &&\n            variant === \"outline\" &&\n            (orientation === \"horizontal\"\n              ? \"[&>[data-slot=toggle-group-item]:not(:first-child)]:-ml-px\"\n              : \"[&>[data-slot=toggle-group-item]:not(:first-child)]:-mt-px\"),\n          className,\n        )}\n        onKeyDown={(event) => {\n          onKeyDown?.(event);\n\n          if (event.defaultPrevented) {\n            return;\n          }\n\n          const previousKey =\n            orientation === \"vertical\" ? \"ArrowUp\" : \"ArrowLeft\";\n          const nextKey =\n            orientation === \"vertical\" ? \"ArrowDown\" : \"ArrowRight\";\n\n          if (![previousKey, nextKey, \"Home\", \"End\"].includes(event.key)) {\n            return;\n          }\n\n          const items = [\n            ...event.currentTarget.querySelectorAll<HTMLButtonElement>(\n              \"[data-slot=toggle-group-item]:not(:disabled)\",\n            ),\n          ];\n          const index = items.indexOf(\n            document.activeElement as HTMLButtonElement,\n          );\n\n          if (items.length === 0 || index === -1) {\n            return;\n          }\n\n          event.preventDefault();\n\n          const target =\n            event.key === \"Home\"\n              ? 0\n              : event.key === \"End\"\n                ? items.length - 1\n                : event.key === nextKey\n                  ? (index + 1) % items.length\n                  : (index - 1 + items.length) % items.length;\n\n          items[target]?.focus();\n        }}\n      />\n    </ToggleGroupContext.Provider>\n  );\n}\n\nexport type ToggleGroupItemProps = Omit<\n  React.ComponentProps<\"button\">,\n  \"value\" | \"aria-pressed\"\n> & {\n  /** Unique value reported in the group's `value`. */\n  value: string;\n};\n\nexport function ToggleGroupItem({\n  value,\n  disabled,\n  className,\n  ref,\n  onClick,\n  ...props\n}: ToggleGroupItemProps) {\n  const group = useToggleGroup();\n  const pressed = group.value.includes(value);\n  const isDisabled = group.disabled || disabled;\n\n  return (\n    <button\n      {...props}\n      ref={ref}\n      type=\"button\"\n      aria-pressed={pressed}\n      data-slot=\"toggle-group-item\"\n      data-state={pressed ? \"on\" : \"off\"}\n      data-value={value}\n      disabled={isDisabled}\n      className={cn(\n        toggleVariants({ variant: group.variant, size: group.size }),\n        // Raise the focused/pressed item so its ring and border sit above neighbors.\n        \"focus-visible:z-10\",\n        className,\n      )}\n      onClick={(event) => {\n        onClick?.(event);\n\n        if (!event.defaultPrevented && !isDisabled) {\n          group.toggle(value);\n        }\n      }}\n    />\n  );\n}\n",
      "type": "registry:ui"
    }
  ],
  "docs": "https://vinyaas.vercel.app/components/toggle-group",
  "category": "forms"
}
