{
  "$schema": "https://vinyaas.vercel.app/r/schema/registry-item.json",
  "name": "score-ring",
  "type": "registry:ui",
  "description": "A circular score meter whose color blends from a start to an end color.",
  "dependencies": ["clsx", "tailwind-merge"],
  "files": [
    {
      "path": "ui/score-ring/index.tsx",
      "content": "import React from \"react\";\n\nimport { cn } from \"@/lib/utils\";\n\nexport type ScoreRingSize = \"xs\" | \"sm\" | \"default\" | \"lg\";\n\n// Pixel diameter and stroke width per size. The ring is drawn in a 100-unit\n// viewBox, so `stroke` is a share of the diameter, not px.\nconst sizes: Record<\n  ScoreRingSize,\n  { box: string; stroke: number; text: string }\n> = {\n  xs: { box: \"size-8\", stroke: 12, text: \"text-[10px]\" },\n  sm: { box: \"size-12\", stroke: 10, text: \"text-xs\" },\n  default: { box: \"size-16\", stroke: 9, text: \"text-base\" },\n  lg: { box: \"size-24\", stroke: 8, text: \"text-2xl\" },\n};\n\nexport type ScoreRingProps = Omit<\n  React.ComponentProps<\"div\">,\n  \"children\" | \"role\"\n> & {\n  /** Score from 0 to `max`. Values outside the range are clamped. */\n  value: number;\n  /** Score that fills the whole ring. Defaults to 100. */\n  max?: number;\n  size?: ScoreRingSize;\n  /** Ring color at a score of 0. Any CSS color. Defaults to red. */\n  fromColor?: string;\n  /** Ring color at the maximum score. Any CSS color. Defaults to green. */\n  toColor?: string;\n  /** Show the score in the middle of the ring. Defaults to true. */\n  showValue?: boolean;\n  /** Replaces the default score text in the middle of the ring. */\n  children?: React.ReactNode;\n  /** Accessible name, e.g. \"Performance score\". */\n  label?: string;\n};\n\nfunction clamp(value: number, min: number, max: number) {\n  return Math.min(Math.max(value, min), max);\n}\n\n/**\n * A circular score meter. The stroke color is mixed between `fromColor` and\n * `toColor` by the score (`color-mix` in oklch, which passes through orange\n * and yellow for the default red to green), so 0 is `fromColor` and the max\n * is `toColor`. Pass `label` so the meter has an accessible name.\n */\nexport function ScoreRing({\n  value,\n  max = 100,\n  size = \"default\",\n  fromColor = \"var(--color-red-500, #ef4444)\",\n  toColor = \"var(--color-green-500, #22c55e)\",\n  showValue = true,\n  label,\n  children,\n  className,\n  style,\n  ref,\n  ...props\n}: ScoreRingProps) {\n  const safeMax = max > 0 ? max : 100;\n  const score = clamp(Number.isFinite(value) ? value : 0, 0, safeMax);\n  const ratio = score / safeMax;\n  const { box, stroke, text } = sizes[size];\n  const radius = 50 - stroke / 2;\n  const circumference = 2 * Math.PI * radius;\n  const color = `color-mix(in oklch, ${toColor} ${Math.round(ratio * 100)}%, ${fromColor})`;\n\n  return (\n    <div\n      {...props}\n      ref={ref}\n      role=\"meter\"\n      aria-label={label}\n      aria-valuemin={0}\n      aria-valuemax={safeMax}\n      aria-valuenow={score}\n      data-slot=\"score-ring\"\n      data-size={size}\n      style={style}\n      className={cn(\n        \"relative inline-flex shrink-0 items-center justify-center\",\n        box,\n        className,\n      )}\n    >\n      <svg\n        viewBox=\"0 0 100 100\"\n        aria-hidden=\"true\"\n        className=\"size-full -rotate-90\"\n        fill=\"none\"\n      >\n        <circle\n          cx=\"50\"\n          cy=\"50\"\n          r={radius}\n          stroke=\"currentColor\"\n          strokeWidth={stroke}\n          className=\"text-muted\"\n        />\n        <circle\n          data-slot=\"score-ring-indicator\"\n          cx=\"50\"\n          cy=\"50\"\n          r={radius}\n          // Inline style (not the stroke attribute) so var() colors resolve.\n          style={{ stroke: color }}\n          strokeWidth={stroke}\n          strokeLinecap=\"round\"\n          strokeDasharray={circumference}\n          strokeDashoffset={circumference * (1 - ratio)}\n          className=\"transition-[stroke-dashoffset,stroke] duration-500 ease-out motion-reduce:transition-none\"\n        />\n      </svg>\n      {children !== undefined || showValue ? (\n        <span\n          className={cn(\n            \"text-foreground absolute inset-0 flex items-center justify-center leading-none font-semibold tabular-nums\",\n            text,\n          )}\n        >\n          {children ?? Math.round(score)}\n        </span>\n      ) : null}\n    </div>\n  );\n}\n",
      "type": "registry:ui"
    }
  ],
  "docs": "https://vinyaas.vercel.app/components/score-ring",
  "category": "data-display"
}
