{
  "$schema": "https://vinyaas.vercel.app/schema/registry-item.json",
  "name": "tabs",
  "type": "registry:ui",
  "description": "A set of panels that share one visible view at a time.",
  "dependencies": ["class-variance-authority", "clsx", "tailwind-merge"],
  "files": [
    {
      "path": "ui/tabs/index.tsx",
      "content": "\"use client\";\n\nimport React, {\n  createContext,\n  useContext,\n  useId,\n  useRef,\n  useState,\n} from \"react\";\nimport { cva, type VariantProps } from \"class-variance-authority\";\n\nimport { cn } from \"@/lib/utils\";\n\ntype TabsContextValue = {\n  value: string;\n  orientation: \"horizontal\" | \"vertical\";\n  disabled: boolean;\n  baseId: string;\n  setValue: (value: string) => void;\n};\n\nconst TabsContext = createContext<TabsContextValue | null>(null);\n\nfunction useTabs() {\n  const context = useContext(TabsContext);\n\n  if (!context) {\n    throw new Error(\"Tabs components must render inside Tabs.\");\n  }\n\n  return context;\n}\n\nfunction triggerId(baseId: string, value: string) {\n  return `${baseId}-trigger-${value}`;\n}\n\nfunction contentId(baseId: string, value: string) {\n  return `${baseId}-content-${value}`;\n}\n\nexport type TabsProps = Omit<\n  React.ComponentProps<\"div\">,\n  \"defaultValue\" | \"dir\"\n> & {\n  value?: string;\n  defaultValue?: string;\n  onValueChange?: (value: string) => void;\n  orientation?: \"horizontal\" | \"vertical\";\n  disabled?: boolean;\n};\n\nexport function Tabs({\n  className,\n  value,\n  defaultValue,\n  onValueChange,\n  orientation = \"horizontal\",\n  disabled = false,\n  children,\n  ...props\n}: TabsProps) {\n  const controlled = value !== undefined;\n  const [uncontrolled, setUncontrolled] = useState(defaultValue ?? \"\");\n  const current = controlled ? (value ?? \"\") : uncontrolled;\n  const baseId = useId();\n\n  function setValue(next: string) {\n    if (!controlled) {\n      setUncontrolled(next);\n    }\n\n    onValueChange?.(next);\n  }\n\n  return (\n    <TabsContext.Provider\n      value={{\n        value: current,\n        orientation,\n        disabled,\n        baseId,\n        setValue,\n      }}\n    >\n      <div\n        data-orientation={orientation}\n        className={cn(\n          \"group/tabs flex gap-2\",\n          orientation === \"vertical\" ? \"flex-row\" : \"flex-col\",\n          className,\n        )}\n        {...props}\n      >\n        {children}\n      </div>\n    </TabsContext.Provider>\n  );\n}\n\nconst tabsListVariants = cva(\n  \"group/tabs-list text-muted-foreground inline-flex w-fit max-w-full items-center justify-center rounded-lg p-[3px] data-[variant=line]:rounded-none\",\n  {\n    variants: {\n      variant: {\n        default: \"bg-muted\",\n        line: \"gap-1 border-border rounded-none bg-transparent p-0 pb-px\",\n      },\n    },\n    defaultVariants: {\n      variant: \"default\",\n    },\n  },\n);\n\nexport type TabsListProps = React.ComponentProps<\"div\"> &\n  VariantProps<typeof tabsListVariants>;\n\nexport function TabsList({\n  className,\n  variant = \"default\",\n  onKeyDown,\n  ...props\n}: TabsListProps) {\n  const { orientation, disabled } = useTabs();\n  const listRef = useRef<HTMLDivElement>(null);\n\n  function focusTrigger(triggers: HTMLButtonElement[], index: number) {\n    const next = triggers[index];\n\n    if (!next) {\n      return;\n    }\n\n    next.focus();\n  }\n\n  return (\n    <div\n      {...props}\n      ref={listRef}\n      role=\"tablist\"\n      aria-orientation={orientation}\n      data-variant={variant ?? \"default\"}\n      {...(disabled ? { \"aria-disabled\": true } : {})}\n      className={cn(\n        tabsListVariants({ variant }),\n        orientation === \"vertical\"\n          ? \"h-auto min-w-28 shrink-0 flex-col overflow-visible\"\n          : \"h-9 flex-row overflow-x-auto overflow-y-hidden\",\n        className,\n      )}\n      onKeyDown={(event) => {\n        onKeyDown?.(event);\n\n        if (event.defaultPrevented || disabled) {\n          return;\n        }\n\n        const key = event.key;\n        const forward = orientation === \"vertical\" ? \"ArrowDown\" : \"ArrowRight\";\n        const backward = orientation === \"vertical\" ? \"ArrowUp\" : \"ArrowLeft\";\n\n        if (![forward, backward, \"Home\", \"End\"].includes(key)) {\n          return;\n        }\n\n        const triggers = [\n          ...(listRef.current?.querySelectorAll<HTMLButtonElement>(\n            '[role=\"tab\"]',\n          ) ?? []),\n        ].filter((trigger) => !trigger.disabled);\n        const index = triggers.indexOf(\n          document.activeElement as HTMLButtonElement,\n        );\n\n        if (index < 0 || triggers.length === 0) {\n          return;\n        }\n\n        event.preventDefault();\n\n        if (key === \"Home\") {\n          focusTrigger(triggers, 0);\n          return;\n        }\n\n        if (key === \"End\") {\n          focusTrigger(triggers, triggers.length - 1);\n          return;\n        }\n\n        const delta = key === forward ? 1 : -1;\n        const next = (index + delta + triggers.length) % triggers.length;\n        focusTrigger(triggers, next);\n      }}\n    />\n  );\n}\n\nexport type TabsTriggerProps = Omit<React.ComponentProps<\"button\">, \"value\"> & {\n  value: string;\n};\n\nexport function TabsTrigger({\n  className,\n  value,\n  disabled,\n  onClick,\n  ...props\n}: TabsTriggerProps) {\n  const tabs = useTabs();\n  const selected = tabs.value === value;\n  const isDisabled = Boolean(disabled || tabs.disabled);\n\n  return (\n    <button\n      type=\"button\"\n      role=\"tab\"\n      id={triggerId(tabs.baseId, value)}\n      aria-selected={selected}\n      aria-controls={contentId(tabs.baseId, value)}\n      data-state={selected ? \"active\" : \"inactive\"}\n      data-value={value}\n      tabIndex={selected ? 0 : -1}\n      disabled={isDisabled}\n      className={cn(\n        \"focus-visible:ring-ring relative inline-flex h-[calc(100%-1px)] shrink-0 items-center justify-center gap-1.5 rounded-md border border-transparent px-2 py-1 text-sm font-medium whitespace-nowrap transition-[color,background-color,box-shadow,opacity] focus-visible:ring-2 focus-visible:outline-none disabled:pointer-events-none disabled:opacity-50\",\n        \"text-foreground/60 hover:text-foreground dark:text-muted-foreground dark:hover:text-foreground\",\n        \"data-[state=active]:bg-background data-[state=active]:text-foreground data-[state=active]:shadow-sm\",\n        \"group-data-[variant=line]/tabs-list:data-[state=active]:bg-transparent group-data-[variant=line]/tabs-list:data-[state=active]:shadow-none\",\n        \"after:bg-foreground after:absolute after:opacity-0 after:transition-opacity group-data-[orientation=horizontal]/tabs:after:inset-x-0 group-data-[orientation=horizontal]/tabs:after:bottom-0 group-data-[orientation=horizontal]/tabs:after:h-0.5 group-data-[orientation=vertical]/tabs:after:inset-y-0 group-data-[orientation=vertical]/tabs:after:right-0 group-data-[orientation=vertical]/tabs:after:w-0.5 group-data-[variant=line]/tabs-list:data-[state=active]:after:opacity-100\",\n        tabs.orientation === \"vertical\" && \"w-full justify-start\",\n        className,\n      )}\n      {...props}\n      onClick={(event) => {\n        onClick?.(event);\n\n        if (event.defaultPrevented || isDisabled) {\n          return;\n        }\n\n        tabs.setValue(value);\n      }}\n    />\n  );\n}\n\nexport type TabsContentProps = React.ComponentProps<\"div\"> & {\n  value: string;\n  forceMount?: boolean;\n};\n\nexport function TabsContent({\n  className,\n  value,\n  forceMount = false,\n  children,\n  ...props\n}: TabsContentProps) {\n  const tabs = useTabs();\n  const selected = tabs.value === value;\n\n  if (!forceMount && !selected) {\n    return null;\n  }\n\n  return (\n    <div\n      role=\"tabpanel\"\n      id={contentId(tabs.baseId, value)}\n      aria-labelledby={triggerId(tabs.baseId, value)}\n      data-state={selected ? \"active\" : \"inactive\"}\n      data-value={value}\n      hidden={!selected}\n      tabIndex={0}\n      className={cn(\n        \"ring-offset-background focus-visible:ring-ring flex-1 outline-none focus-visible:ring-2 focus-visible:ring-offset-2\",\n        className,\n      )}\n      {...props}\n    >\n      {children}\n    </div>\n  );\n}\n",
      "type": "registry:ui"
    }
  ]
}
