{
  "$schema": "https://vinyaas.vercel.app/r/schema/registry-item.json",
  "name": "pagination",
  "type": "registry:ui",
  "description": "Composable page navigation with previous, next, page links, and ellipsis.",
  "dependencies": ["class-variance-authority", "clsx", "tailwind-merge"],
  "registryDependencies": ["button"],
  "files": [
    {
      "path": "ui/pagination/index.tsx",
      "content": "import React from \"react\";\nimport { type VariantProps } from \"class-variance-authority\";\n\nimport { cn } from \"@/lib/utils\";\nimport { buttonVariants } from \"../button\";\n\nexport type PaginationProps = React.ComponentProps<\"nav\">;\n\nexport function Pagination({ className, ...props }: PaginationProps) {\n  return (\n    <nav\n      role=\"navigation\"\n      aria-label=\"Pagination\"\n      data-slot=\"pagination\"\n      className={cn(\"mx-auto flex w-full justify-center\", className)}\n      {...props}\n    />\n  );\n}\n\nexport type PaginationContentProps = React.ComponentProps<\"ul\">;\n\nexport function PaginationContent({\n  className,\n  ...props\n}: PaginationContentProps) {\n  return (\n    <ul\n      data-slot=\"pagination-content\"\n      className={cn(\n        \"flex flex-row flex-nowrap items-center justify-center gap-1\",\n        className,\n      )}\n      {...props}\n    />\n  );\n}\n\nexport type PaginationItemProps = React.ComponentProps<\"li\">;\n\nexport function PaginationItem({ className, ...props }: PaginationItemProps) {\n  return (\n    <li\n      data-slot=\"pagination-item\"\n      className={cn(\"shrink-0\", className)}\n      {...props}\n    />\n  );\n}\n\ntype PaginationLinkShared = {\n  isActive?: boolean;\n  size?: VariantProps<typeof buttonVariants>[\"size\"];\n  className?: string;\n  children?: React.ReactNode;\n  disabled?: boolean;\n  /** When set, renders an anchor. When omitted, renders a button. */\n  href?: string;\n};\n\nexport type PaginationLinkProps = PaginationLinkShared &\n  Omit<\n    React.AnchorHTMLAttributes<HTMLAnchorElement> &\n      React.ButtonHTMLAttributes<HTMLButtonElement>,\n    \"href\" | \"disabled\" | \"className\" | \"children\" | \"type\" | \"aria-current\"\n  >;\n\n/**\n * Page control. Pass `href` for link navigation, or omit it for a button\n * the consumer wires with onClick / routing.\n */\nexport function PaginationLink({\n  className,\n  isActive = false,\n  size = \"icon\",\n  disabled = false,\n  href,\n  children,\n  ...props\n}: PaginationLinkProps) {\n  const classes = cn(\n    buttonVariants({\n      variant: isActive ? \"outline\" : \"ghost\",\n      size,\n    }),\n    isActive && \"pointer-events-none\",\n    className,\n  );\n\n  if (typeof href === \"string\") {\n    const { onClick, ...anchorProps } =\n      props as React.AnchorHTMLAttributes<HTMLAnchorElement>;\n\n    return (\n      <a\n        href={href}\n        aria-current={isActive ? \"page\" : undefined}\n        aria-disabled={disabled || undefined}\n        tabIndex={disabled ? -1 : undefined}\n        data-slot=\"pagination-link\"\n        data-active={isActive ? \"\" : undefined}\n        className={cn(classes, disabled && \"pointer-events-none opacity-50\")}\n        {...anchorProps}\n        onClick={(event) => {\n          if (disabled) {\n            event.preventDefault();\n            return;\n          }\n\n          onClick?.(event);\n        }}\n      >\n        {children}\n      </a>\n    );\n  }\n\n  return (\n    <button\n      type=\"button\"\n      disabled={disabled}\n      aria-current={isActive ? \"page\" : undefined}\n      data-slot=\"pagination-link\"\n      data-active={isActive ? \"\" : undefined}\n      className={classes}\n      {...props}\n    >\n      {children}\n    </button>\n  );\n}\n\nexport type PaginationPreviousProps = PaginationLinkProps;\n\nexport function PaginationPrevious({\n  className,\n  size = \"default\",\n  ...props\n}: PaginationPreviousProps) {\n  return (\n    <PaginationLink\n      aria-label=\"Go to previous page\"\n      size={size}\n      className={cn(\"gap-1\", size === \"default\" && \"px-2.5\", className)}\n      {...props}\n    >\n      <ChevronLeftIcon className=\"size-4\" />\n      <span className=\"hidden sm:inline\">Previous</span>\n    </PaginationLink>\n  );\n}\n\nexport type PaginationNextProps = PaginationLinkProps;\n\nexport function PaginationNext({\n  className,\n  size = \"default\",\n  ...props\n}: PaginationNextProps) {\n  return (\n    <PaginationLink\n      aria-label=\"Go to next page\"\n      size={size}\n      className={cn(\"gap-1\", size === \"default\" && \"px-2.5\", className)}\n      {...props}\n    >\n      <span className=\"hidden sm:inline\">Next</span>\n      <ChevronRightIcon className=\"size-4\" />\n    </PaginationLink>\n  );\n}\n\nexport type PaginationEllipsisProps = React.ComponentProps<\"span\">;\n\nexport function PaginationEllipsis({\n  className,\n  ...props\n}: PaginationEllipsisProps) {\n  return (\n    <span\n      data-slot=\"pagination-ellipsis\"\n      className={cn(\n        \"text-muted-foreground flex size-9 items-center justify-center\",\n        className,\n      )}\n      {...props}\n    >\n      <span aria-hidden=\"true\" className=\"text-sm tracking-widest\">\n        …\n      </span>\n      <span className=\"sr-only\">More pages</span>\n    </span>\n  );\n}\n\nfunction ChevronLeftIcon({ className }: { className?: string }) {\n  return (\n    <svg\n      viewBox=\"0 0 24 24\"\n      fill=\"none\"\n      stroke=\"currentColor\"\n      strokeWidth=\"2\"\n      strokeLinecap=\"round\"\n      strokeLinejoin=\"round\"\n      aria-hidden=\"true\"\n      className={className}\n    >\n      <path d=\"m15 6-6 6 6 6\" />\n    </svg>\n  );\n}\n\nfunction ChevronRightIcon({ className }: { className?: string }) {\n  return (\n    <svg\n      viewBox=\"0 0 24 24\"\n      fill=\"none\"\n      stroke=\"currentColor\"\n      strokeWidth=\"2\"\n      strokeLinecap=\"round\"\n      strokeLinejoin=\"round\"\n      aria-hidden=\"true\"\n      className={className}\n    >\n      <path d=\"m9 6 6 6-6 6\" />\n    </svg>\n  );\n}\n",
      "type": "registry:ui"
    }
  ],
  "docs": "https://vinyaas.vercel.app/components/pagination",
  "category": "navigation"
}
