{
  "$schema": "https://vinyaas.vercel.app/r/schema/registry-item.json",
  "name": "input-group",
  "type": "registry:ui",
  "description": "A field with icons, text, and actions in one row.",
  "dependencies": ["clsx", "tailwind-merge"],
  "files": [
    {
      "path": "ui/input-group/index.tsx",
      "content": "\"use client\";\n\nimport React from \"react\";\n\nimport { cn } from \"@/lib/utils\";\n\nexport type InputGroupProps = React.ComponentProps<\"div\">;\n\nexport function InputGroup({ className, ...props }: InputGroupProps) {\n  return (\n    <div\n      className={cn(\n        \"border-input bg-background box-border min-h-9 focus-within:ring-ring focus-within:ring-offset-background flex w-full items-center gap-2 rounded-md border px-3 focus-within:ring-2 focus-within:ring-offset-2\",\n        \"has-[textarea]:items-start has-[textarea]:py-2\",\n        className,\n      )}\n      {...props}\n    />\n  );\n}\n\nexport type InputGroupAddonProps = React.ComponentProps<\"span\">;\n\nexport function InputGroupAddon({ className, ...props }: InputGroupAddonProps) {\n  return (\n    <span\n      className={cn(\n        \"text-muted-foreground inline-flex shrink-0 items-center gap-1 text-sm [&_svg]:pointer-events-none [&_svg]:size-4\",\n        className,\n      )}\n      {...props}\n    />\n  );\n}\n\nexport type InputGroupTextProps = React.ComponentProps<\"span\">;\n\nexport function InputGroupText({ className, ...props }: InputGroupTextProps) {\n  return (\n    <span\n      className={cn(\"text-muted-foreground shrink-0 text-sm\", className)}\n      {...props}\n    />\n  );\n}\n\nexport type InputGroupInputProps = React.ComponentProps<\"input\">;\n\nexport function InputGroupInput({ className, ...props }: InputGroupInputProps) {\n  return (\n    <input\n      className={cn(\n        \"text-foreground placeholder:text-muted-foreground h-[2.125rem] min-w-0 flex-1 bg-transparent text-sm outline-none disabled:cursor-not-allowed disabled:opacity-50\",\n        className,\n      )}\n      {...props}\n    />\n  );\n}\n\nexport type InputGroupTextareaProps = React.ComponentProps<\"textarea\">;\n\nexport function InputGroupTextarea({\n  className,\n  ...props\n}: InputGroupTextareaProps) {\n  return (\n    <textarea\n      className={cn(\n        \"text-foreground placeholder:text-muted-foreground min-h-20 min-w-0 flex-1 resize-y bg-transparent py-1 text-sm outline-none disabled:cursor-not-allowed disabled:opacity-50\",\n        className,\n      )}\n      {...props}\n    />\n  );\n}\n\nexport type InputGroupButtonProps = React.ComponentProps<\"button\">;\n\nexport function InputGroupButton({\n  className,\n  type = \"button\",\n  ...props\n}: InputGroupButtonProps) {\n  return (\n    <button\n      type={type}\n      className={cn(\n        \"text-foreground hover:bg-accent focus-visible:ring-ring focus-visible:ring-offset-background inline-flex h-7 shrink-0 cursor-pointer items-center rounded-md px-2 text-sm font-medium focus-visible:ring-2 focus-visible:ring-offset-2 focus-visible:outline-none disabled:cursor-not-allowed disabled:opacity-50\",\n        className,\n      )}\n      {...props}\n    />\n  );\n}\n",
      "type": "registry:ui"
    }
  ],
  "docs": "https://vinyaas.vercel.app/components/input-group",
  "category": "forms"
}
