{
  "$schema": "https://vinyaas.vercel.app/r/schema/registry-item.json",
  "name": "resizable",
  "type": "registry:ui",
  "description": "Resizable panel layouts with accessible drag handles for dashboards.",
  "dependencies": ["react-resizable-panels", "clsx", "tailwind-merge"],
  "files": [
    {
      "path": "ui/resizable/index.tsx",
      "content": "\"use client\";\n\nimport { createContext, useContext } from \"react\";\nimport {\n  Group,\n  Panel,\n  Separator as PanelSeparator,\n  type GroupProps,\n  type PanelProps,\n  type SeparatorProps as PanelSeparatorProps,\n} from \"react-resizable-panels\";\n\nimport { cn } from \"@/lib/utils\";\n\nexport type ResizableVariant = \"default\" | \"blocks\";\n\nconst ResizableVariantContext = createContext<ResizableVariant>(\"default\");\n\nexport type ResizablePanelGroupProps = GroupProps & {\n  /**\n   * `default` is one surface split by a thin line. `blocks` renders each\n   * panel as its own bordered block with a small gutter between them; the\n   * gutter is the drag target and shows a three-dot grip when the handle\n   * sets `withHandle`.\n   */\n  variant?: ResizableVariant;\n};\n\n/**\n * Resizable panel group backed by `react-resizable-panels`.\n * Orientation comes from the library; vertical groups stack via ARIA.\n *\n * Cursor feedback (including corner/crossing 2D cursors when horizontal and\n * vertical handles intersect) is owned by the library — do not set\n * `disableCursor` unless you replace that behavior.\n */\nexport function ResizablePanelGroup({\n  className,\n  variant = \"default\",\n  ...props\n}: ResizablePanelGroupProps) {\n  return (\n    <ResizableVariantContext.Provider value={variant}>\n      <Group\n        data-slot=\"resizable-panel-group\"\n        data-variant={variant}\n        className={cn(\n          \"flex h-full w-full aria-[orientation=vertical]:flex-col\",\n          className,\n        )}\n        {...props}\n      />\n    </ResizableVariantContext.Provider>\n  );\n}\n\nexport type ResizablePanelProps = PanelProps;\n\nexport function ResizablePanel({ className, ...props }: ResizablePanelProps) {\n  const variant = useContext(ResizableVariantContext);\n\n  return (\n    <Panel\n      data-slot=\"resizable-panel\"\n      className={cn(\n        \"min-h-0 min-w-0\",\n        variant === \"blocks\" &&\n          \"border-border bg-card overflow-hidden rounded-lg border\",\n        className,\n      )}\n      {...props}\n    />\n  );\n}\n\nexport type ResizableHandleProps = PanelSeparatorProps & {\n  /**\n   * Renders a centered orientation-aware grip affordance on the separator:\n   * the dot grip in a `default` group, the three-dot grip in a `blocks` group.\n   * Defaults to `false` in both.\n   */\n  withHandle?: boolean;\n};\n\n/**\n * Grip is always a 2×3 dot grid (horizontal-resize / vertical bar).\n * On a horizontal separator (vertical resize), rotate 90° so it reads as 3×2.\n *\n * Secondary surface, rounded, padded, no border. Dots use foreground.\n */\nfunction ResizableHandleGrip() {\n  return (\n    <div\n      aria-hidden=\"true\"\n      data-slot=\"resizable-handle-grip\"\n      className={cn(\n        \"bg-secondary z-10 flex shrink-0 items-center justify-center rounded-sm p-1\",\n        // Vertical-resize bar: tip the same 2×3 grip onto its side.\n        \"group-aria-[orientation=horizontal]/resizable-handle:rotate-90\",\n      )}\n    >\n      <div\n        data-slot=\"resizable-handle-grip-dots\"\n        className=\"grid grid-cols-2 gap-0.5\"\n      >\n        {Array.from({ length: 6 }, (_, index) => (\n          <span\n            key={index}\n            className=\"bg-foreground size-0.5 shrink-0 rounded-full\"\n          />\n        ))}\n      </div>\n    </div>\n  );\n}\n\n/**\n * Three-dot grip for the `blocks` variant, rendered only with `withHandle`.\n * The gutter is the whole gap between blocks, so the dots sit on the page\n * background with no box. Rotated on horizontal separators (vertical resize).\n */\nfunction ResizableHandleDots() {\n  return (\n    <svg\n      viewBox=\"0 0 4 16\"\n      aria-hidden=\"true\"\n      data-slot=\"resizable-handle-dots\"\n      className={cn(\n        \"text-muted-foreground/60 group-hover/resizable-handle:text-foreground group-data-[separator=active]/resizable-handle:text-foreground h-4 w-1 shrink-0 transition-colors\",\n        \"group-aria-[orientation=horizontal]/resizable-handle:rotate-90\",\n      )}\n      fill=\"currentColor\"\n    >\n      <circle cx=\"2\" cy=\"2.5\" r=\"1.4\" />\n      <circle cx=\"2\" cy=\"8\" r=\"1.4\" />\n      <circle cx=\"2\" cy=\"13.5\" r=\"1.4\" />\n    </svg>\n  );\n}\n\n/**\n * Keyboard-accessible resize handle (`role=\"separator\"` from the library).\n *\n * Visual bar stays thin (`w-px` / `h-px`). A wider centered `::after` hit\n * target improves pointer and touch use. Orientation drives dimensions,\n * cursor fallback, hit-area axis, and grip dot arrangement.\n *\n * Default styles size a vertical bar (horizontal group → `col-resize`).\n * When the separator reports `aria-orientation=\"horizontal\"` (vertical group),\n * classes flip to a horizontal bar (`row-resize`). Height of the vertical bar\n * comes from flex stretch — do not force `h-full`.\n */\nexport function ResizableHandle({\n  className,\n  withHandle,\n  disabled,\n  ...props\n}: ResizableHandleProps) {\n  const blocks = useContext(ResizableVariantContext) === \"blocks\";\n  // The grip is opt-in in both variants: in `blocks` the three dots are the\n  // only visible handle, so they follow `withHandle` rather than the variant.\n  const showHandle = withHandle === true;\n\n  return (\n    <PanelSeparator\n      data-slot=\"resizable-handle\"\n      data-hit-area=\"expanded\"\n      disabled={disabled}\n      className={cn(\n        \"group/resizable-handle\",\n        \"bg-border focus-visible:ring-ring relative flex w-px items-center justify-center\",\n        // Fallback when the library hover stylesheet is inactive. Crossing\n        // handles override via the library's 2D cursor (move / grab / nwse*).\n        \"cursor-col-resize\",\n        \"after:absolute after:inset-y-0 after:left-1/2 after:w-3 after:-translate-x-1/2\",\n        \"focus-visible:ring-1 focus-visible:ring-offset-1 focus-visible:outline-none\",\n        \"aria-[orientation=horizontal]:h-px aria-[orientation=horizontal]:w-full\",\n        \"aria-[orientation=horizontal]:cursor-row-resize\",\n        \"aria-[orientation=horizontal]:after:inset-x-0 aria-[orientation=horizontal]:after:top-1/2\",\n        \"aria-[orientation=horizontal]:after:left-0 aria-[orientation=horizontal]:after:h-3\",\n        \"aria-[orientation=horizontal]:after:w-full aria-[orientation=horizontal]:after:translate-x-0\",\n        \"aria-[orientation=horizontal]:after:-translate-y-1/2\",\n        \"data-[separator=active]:bg-ring\",\n        blocks &&\n          \"w-2 bg-transparent aria-[orientation=horizontal]:h-2 data-[separator=active]:bg-transparent\",\n        \"motion-reduce:transition-none\",\n        disabled && \"pointer-events-none opacity-50\",\n        className,\n      )}\n      {...props}\n    >\n      {showHandle ? (\n        blocks ? (\n          <ResizableHandleDots />\n        ) : (\n          <ResizableHandleGrip />\n        )\n      ) : null}\n    </PanelSeparator>\n  );\n}\n",
      "type": "registry:ui"
    }
  ],
  "docs": "https://vinyaas.vercel.app/components/resizable",
  "category": "layout"
}
