{
  "$schema": "https://vinyaas.vercel.app/r/schema/registry-item.json",
  "name": "user-cursor",
  "type": "registry:ui",
  "description": "A Figma-style collaborative cursor with an arrow pointer and a rounded name label.",
  "dependencies": ["clsx", "tailwind-merge"],
  "files": [
    {
      "path": "ui/user-cursor/index.tsx",
      "content": "import { cn } from \"@/lib/utils\";\n\nexport type LabelVariant = \"rounded\" | \"pill\" | \"bubble\" | \"chat\" | \"square\";\nexport type CursorVariant = \"default\" | \"minimal\";\n\nexport interface UserCursorProps {\n  /** Display name shown on the label. */\n  name: string;\n  /** Accent color used for both the cursor and the label background. */\n  color?: string;\n  /** Hide the name label; useful when only the pointer is needed. */\n  labelHidden?: boolean;\n  /**\n   * Visual style of the name label.\n   * - `\"rounded\"` — compact rectangle with rounded corners (default)\n   * - `\"pill\"` — fully capsule-shaped tag\n   * - `\"bubble\"` — speech-bubble with a prominent triangular tail at bottom-left\n   * - `\"chat\"` — chat message bubble; one corner near the cursor is flat\n   * - `\"square\"` — flat rectangle, no rounding\n   */\n  labelVariant?: LabelVariant;\n  /**\n   * Shape of the cursor arrow.\n   * - `\"default\"` — full arrow with a diagonal stem (cursor.chat / classic style)\n   * - `\"minimal\"` — clean triangular arrow without the stem (Figma-style)\n   */\n  cursorVariant?: CursorVariant;\n  className?: string;\n}\n\n/**\n * A collaborative cursor with a name tag anchored to its tip.\n * The label shape is controlled by `labelVariant`;\n * the cursor arrow shape is controlled by `cursorVariant`.\n */\nexport function UserCursor({\n  name,\n  color = \"var(--primary)\",\n  labelHidden = false,\n  labelVariant = \"rounded\",\n  cursorVariant = \"default\",\n  className,\n}: UserCursorProps) {\n  return (\n    <div\n      data-slot=\"user-cursor\"\n      className={cn(\"inline-flex items-start select-none\", className)}\n    >\n      <svg\n        aria-hidden\n        width=\"14\"\n        height=\"18\"\n        viewBox=\"0 0 14 18\"\n        fill=\"none\"\n        className=\"shrink-0\"\n      >\n        {cursorVariant === \"minimal\" ? (\n          /* Figma-style: clean arrow head only, no diagonal stem */\n          <>\n            <path\n              d=\"M2 2L2 14L6 10.5L12 9.5Z\"\n              fill=\"rgba(0,0,0,0.18)\"\n              transform=\"translate(0.4, 0.4)\"\n            />\n            <path d=\"M2 2L2 14L6 10.5L12 9.5Z\" fill={color} />\n          </>\n        ) : (\n          /* Default: arrow with diagonal stem (cursor.chat style) */\n          <>\n            <path\n              d=\"M2 2L2 13.5L5 10.5L7.2 16L9 15.3L6.8 9.8L12 9.8Z\"\n              fill=\"rgba(0,0,0,0.2)\"\n              transform=\"translate(0.4, 0.4)\"\n            />\n            <path\n              d=\"M2 2L2 13.5L5 10.5L7.2 16L9 15.3L6.8 9.8L12 9.8Z\"\n              fill={color}\n            />\n          </>\n        )}\n      </svg>\n\n      {!labelHidden && (\n        <span\n          data-slot=\"user-cursor-label\"\n          data-variant={labelVariant}\n          className={cn(\n            \"relative mt-3 -ml-0.5 max-w-40 truncate px-2.5 py-1 text-xs leading-none font-semibold text-white shadow-sm\",\n            labelVariant === \"rounded\" && \"rounded-md\",\n            labelVariant === \"pill\" && \"rounded-full px-4\",\n            labelVariant === \"bubble\" && \"mt-7 rounded-lg\",\n            labelVariant === \"chat\" && \"mt-2 rounded-lg rounded-tl-none\",\n            labelVariant === \"square\" && \"rounded-none\",\n          )}\n          style={{ backgroundColor: color }}\n        >\n          {labelVariant === \"bubble\" && (\n            /* Triangle tail pointing up-left toward the cursor tip */\n            <span\n              aria-hidden=\"true\"\n              className=\"pointer-events-none absolute -top-1.75 left-0\"\n              style={{\n                width: 0,\n                height: 0,\n                borderRight: \"7px solid transparent\",\n                borderBottom: `7px solid ${color}`,\n              }}\n            />\n          )}\n          {name}\n        </span>\n      )}\n    </div>\n  );\n}\n",
      "type": "registry:ui"
    }
  ],
  "docs": "https://vinyaas.vercel.app/components/user-cursor",
  "category": "utilities"
}
