{
  "$schema": "https://vinyaas.vercel.app/r/schema/registry-item.json",
  "name": "date-picker",
  "type": "registry:ui",
  "description": "A button-triggered calendar popover for choosing a single date.",
  "dependencies": ["date-fns", "clsx", "tailwind-merge"],
  "registryDependencies": ["button", "calendar", "popover"],
  "files": [
    {
      "path": "ui/date-picker/index.tsx",
      "content": "\"use client\";\n\nimport * as React from \"react\";\nimport { format } from \"date-fns\";\n\nimport { cn } from \"@/lib/utils\";\nimport { Button } from \"../button\";\nimport { Calendar } from \"../calendar\";\nimport { Popover, PopoverContent, PopoverTrigger } from \"../popover\";\n\nexport type DatePickerProps = {\n  value?: Date;\n  defaultValue?: Date;\n  onValueChange?: (date: Date | undefined) => void;\n  placeholder?: string;\n  disabled?: boolean;\n  /** date-fns format string for the trigger label. */\n  formatString?: string;\n  id?: string;\n  className?: string;\n  /** Called when the open state changes. */\n  open?: boolean;\n  defaultOpen?: boolean;\n  onOpenChange?: (open: boolean) => void;\n  /** Forwarded to Calendar `disabled` matcher. */\n  disabledDates?: React.ComponentProps<typeof Calendar>[\"disabled\"];\n  \"aria-label\"?: string;\n};\n\n/**\n * Button + Popover + Calendar composition for picking a single date.\n */\nexport function DatePicker({\n  value,\n  defaultValue,\n  onValueChange,\n  placeholder = \"Pick a date\",\n  disabled = false,\n  formatString = \"PPP\",\n  id,\n  className,\n  open,\n  defaultOpen,\n  onOpenChange,\n  disabledDates,\n  \"aria-label\": ariaLabel,\n}: DatePickerProps) {\n  const [uncontrolled, setUncontrolled] = React.useState<Date | undefined>(\n    defaultValue,\n  );\n  const isControlled = value !== undefined;\n  const selected = isControlled ? value : uncontrolled;\n\n  function setSelected(next: Date | undefined) {\n    if (!isControlled) {\n      setUncontrolled(next);\n    }\n    onValueChange?.(next);\n  }\n\n  const [uncontrolledOpen, setUncontrolledOpen] = React.useState(\n    defaultOpen ?? false,\n  );\n  const isOpenControlled = open !== undefined;\n  const isOpen = isOpenControlled ? open : uncontrolledOpen;\n\n  function setOpen(next: boolean) {\n    if (!isOpenControlled) {\n      setUncontrolledOpen(next);\n    }\n    onOpenChange?.(next);\n  }\n\n  const label = selected ? format(selected, formatString) : placeholder;\n\n  return (\n    <Popover open={isOpen} onOpenChange={setOpen}>\n      <PopoverTrigger>\n        <Button\n          id={id}\n          type=\"button\"\n          variant=\"outline\"\n          disabled={disabled}\n          aria-label={ariaLabel ?? (selected ? `Selected date ${label}` : placeholder)}\n          data-empty={!selected ? \"\" : undefined}\n          className={cn(\n            \"w-full min-w-0 justify-start text-left font-normal\",\n            !selected && \"text-muted-foreground\",\n            className,\n          )}\n        >\n          <CalendarGlyph className=\"mr-2 size-4 shrink-0 opacity-70\" />\n          <span className=\"truncate\">{label}</span>\n        </Button>\n      </PopoverTrigger>\n      <PopoverContent className=\"w-auto p-0\" align=\"start\">\n        <Calendar\n          mode=\"single\"\n          selected={selected}\n          onSelect={(date) => {\n            setSelected(date);\n            if (date) {\n              setOpen(false);\n            }\n          }}\n          disabled={disabledDates}\n          autoFocus\n        />\n      </PopoverContent>\n    </Popover>\n  );\n}\n\nfunction CalendarGlyph(props: React.ComponentProps<\"svg\">) {\n  return (\n    <svg\n      viewBox=\"0 0 24 24\"\n      fill=\"none\"\n      stroke=\"currentColor\"\n      strokeWidth=\"2\"\n      strokeLinecap=\"round\"\n      strokeLinejoin=\"round\"\n      aria-hidden=\"true\"\n      {...props}\n    >\n      <path d=\"M8 2v4\" />\n      <path d=\"M16 2v4\" />\n      <rect width=\"18\" height=\"18\" x=\"3\" y=\"4\" rx=\"2\" />\n      <path d=\"M3 10h18\" />\n    </svg>\n  );\n}\n",
      "type": "registry:ui"
    }
  ],
  "docs": "https://vinyaas.vercel.app/components/date-picker",
  "category": "forms"
}
