{
  "$schema": "https://vinyaas.vercel.app/r/schema/registry-item.json",
  "name": "fuse-button",
  "type": "registry:ui",
  "description": "A button with a burning fuse that gives users a countdown to undo a destructive action.",
  "dependencies": ["clsx", "tailwind-merge"],
  "registryDependencies": ["button"],
  "files": [
    {
      "path": "ui/fuse-button/index.tsx",
      "content": "\"use client\";\n\nimport React, { useEffect, useLayoutEffect, useRef, useState } from \"react\";\n\nimport { Button, type ButtonProps } from \"../button\";\nimport { cn } from \"@/lib/utils\";\n\nexport type FuseButtonProps = Omit<ButtonProps, \"onClick\"> & {\n  /**\n   * Whether the fuse is lit. Controlled by the parent: the parent validates in `onActivate`\n   * and sets this to true; the fuse then burns down, calling `onFire` when it reaches zero.\n   */\n  active: boolean;\n  /** Pressed while idle. The parent decides whether to light the fuse. */\n  onActivate: () => void;\n  /** The fuse burned out without an undo. The parent should set `active` back to false. */\n  onFire: () => void;\n  /** Pressed while lit. The parent should set `active` back to false without firing. */\n  onUndo: () => void;\n  /** Length of the fuse in ms. */\n  duration?: number;\n  /**\n   * Label shown while lit, followed by the seconds left. Icon sizes (`icon`, `icon-sm`,\n   * `icon-lg`) have no room for words, so they show only the seconds and this becomes the\n   * accessible name.\n   */\n  undoLabel?: string;\n  /**\n   * `rect` (default) traces the button's own corner radius. `circle` makes the button round\n   * and burns along a true circle; use it for round icon buttons.\n   */\n  shape?: \"rect\" | \"circle\";\n};\n\nconst FUSE_WIDTH = 2;\n\nfunction fuseColor(variant: FuseButtonProps[\"variant\"]): string {\n  return variant === \"destructive\" ? \"var(--destructive)\" : \"var(--primary)\";\n}\n\nconst FALLBACK_RADIUS = 6;\n\nfunction fuseOutline(\n  width: number,\n  height: number,\n  radius: number,\n  inset: number,\n): string {\n  const x0 = inset;\n  const y0 = inset;\n  const x1 = width - inset;\n  const y1 = height - inset;\n  const r = radius;\n  const cx = width / 2;\n  return [\n    `M${cx} ${y0}`,\n    `H${x1 - r}`,\n    `A${r} ${r} 0 0 1 ${x1} ${y0 + r}`,\n    `V${y1 - r}`,\n    `A${r} ${r} 0 0 1 ${x1 - r} ${y1}`,\n    `H${x0 + r}`,\n    `A${r} ${r} 0 0 1 ${x0} ${y1 - r}`,\n    `V${y0 + r}`,\n    `A${r} ${r} 0 0 1 ${x0 + r} ${y0}`,\n    `H${cx}`,\n  ].join(\" \");\n}\n\nfunction fuseCircle(width: number, height: number, inset: number): string {\n  const r = Math.min(width, height) / 2 - inset;\n  const cx = width / 2;\n  const cy = height / 2;\n  return `M${cx} ${cy - r} A${r} ${r} 0 1 1 ${cx} ${cy + r} A${r} ${r} 0 1 1 ${cx} ${cy - r}`;\n}\n\nfunction centreRadius(\n  button: Element,\n  width: number,\n  height: number,\n  inset: number,\n): number {\n  const declared = parseFloat(getComputedStyle(button).borderTopLeftRadius);\n  const outer = Number.isFinite(declared) ? declared : FALLBACK_RADIUS;\n  return Math.max(\n    0,\n    Math.min(outer - inset, width / 2 - inset, height / 2 - inset),\n  );\n}\n\n/**\n * An action button whose lit state is an undo on a burning fuse. The fire starts at the top\n * middle of the border and burns clockwise. No toast: the button itself carries the countdown.\n *\n * Takes every Button size, including icon sizes (`icon`, `icon-sm`, `icon-lg`).\n */\nexport function FuseButton({\n  active,\n  onActivate,\n  onFire,\n  onUndo,\n  duration = 5000,\n  undoLabel = \"Undo\",\n  shape = \"rect\",\n  variant,\n  size,\n  className,\n  disabled,\n  children,\n  ...props\n}: FuseButtonProps) {\n  const buttonRef = useRef<HTMLButtonElement>(null);\n  const svgRef = useRef<SVGSVGElement>(null);\n  const pathRef = useRef<SVGPathElement>(null);\n  const [idleSize, setIdleSize] = useState<{\n    width: number;\n    height: number;\n  } | null>(null);\n  const [secondsLeft, setSecondsLeft] = useState(Math.ceil(duration / 1000));\n  const isIcon = typeof size === \"string\" && size.startsWith(\"icon\");\n\n  const onFireRef = useRef(onFire);\n  useEffect(() => {\n    onFireRef.current = onFire;\n  });\n\n  useLayoutEffect(() => {\n    if (active) return;\n    const button = buttonRef.current;\n    if (!button) return;\n    const measure = () => {\n      const width = button.offsetWidth;\n      const height = button.offsetHeight;\n      setIdleSize((current) =>\n        current && current.width === width && current.height === height\n          ? current\n          : { width, height },\n      );\n    };\n    measure();\n    const ro = new ResizeObserver(measure);\n    ro.observe(button);\n    return () => ro.disconnect();\n  }, [active]);\n\n  useEffect(() => {\n    if (!active) return;\n    const start = performance.now();\n    let frame = 0;\n\n    const tick = (now: number) => {\n      const path = pathRef.current;\n      const svg = svgRef.current;\n      const button = buttonRef.current;\n\n      if (path && svg && button && !path.getAttribute(\"d\")) {\n        const width = button.offsetWidth;\n        const height = button.offsetHeight;\n        const border = parseFloat(getComputedStyle(button).borderTopWidth) || 0;\n        const inset = FUSE_WIDTH / 2;\n        svg.style.inset = `${-border}px`;\n        svg.style.width = `${width}px`;\n        svg.style.height = `${height}px`;\n        path.setAttribute(\"stroke-width\", String(FUSE_WIDTH));\n        path.setAttribute(\n          \"d\",\n          shape === \"circle\"\n            ? fuseCircle(width, height, inset)\n            : fuseOutline(\n                width,\n                height,\n                centreRadius(button, width, height, inset),\n                inset,\n              ),\n        );\n      }\n\n      const left = Math.max(0, duration - (now - start));\n      const share = left / duration;\n      path?.style.setProperty(\"stroke-dasharray\", `${share} 2`);\n      path?.style.setProperty(\"stroke-dashoffset\", `${share - 1}`);\n      const seconds = Math.ceil(left / 1000);\n      setSecondsLeft((current) => (current === seconds ? current : seconds));\n\n      if (left <= 0) {\n        onFireRef.current();\n        return;\n      }\n\n      frame = requestAnimationFrame(tick);\n    };\n\n    frame = requestAnimationFrame(tick);\n    return () => cancelAnimationFrame(frame);\n  }, [active, duration, shape]);\n\n  return (\n    <Button\n      {...props}\n      ref={buttonRef}\n      size={size}\n      variant={active ? \"outline\" : variant}\n      disabled={active ? false : disabled}\n      onClick={() => (active ? onUndo() : onActivate())}\n      className={cn(\n        shape === \"circle\" && \"aspect-square rounded-full\",\n        active && \"relative overflow-hidden tabular-nums\",\n        className,\n      )}\n      style={\n        active && idleSize\n          ? { ...props.style, width: idleSize.width, height: idleSize.height }\n          : props.style\n      }\n      aria-label={active && isIcon ? undoLabel : props[\"aria-label\"]}\n    >\n      {active ? (\n        isIcon ? (\n          <span className=\"text-xs\">{secondsLeft}</span>\n        ) : (\n          `${undoLabel} · ${secondsLeft}s`\n        )\n      ) : (\n        children\n      )}\n      {active ? (\n        <svg\n          aria-hidden\n          ref={svgRef}\n          className=\"pointer-events-none absolute overflow-visible\"\n        >\n          <path\n            ref={pathRef}\n            pathLength={1}\n            fill=\"none\"\n            style={{\n              stroke: fuseColor(variant),\n              filter: `drop-shadow(0 0 3px ${fuseColor(variant)})`,\n            }}\n          />\n        </svg>\n      ) : null}\n    </Button>\n  );\n}\n",
      "type": "registry:ui"
    }
  ],
  "docs": "https://vinyaas.vercel.app/components/fuse-button",
  "category": "forms"
}
