{
  "$schema": "https://vinyaas.vercel.app/r/schema/registry-item.json",
  "name": "dialog",
  "type": "registry:ui",
  "description": "A composable dialog component for confirmations, forms, and interactive workflows.",
  "dependencies": ["clsx", "tailwind-merge"],
  "files": [
    {
      "path": "ui/dialog/index.tsx",
      "content": "\"use client\";\n\nimport React, {\n  useCallback,\n  useContext,\n  useEffect,\n  useId,\n  useRef,\n  useState,\n} from \"react\";\nimport { createPortal } from \"react-dom\";\n\nimport { cn } from \"@/lib/utils\";\n\nimport \"./dialog.css\";\n\ntype DialogContextValue = {\n  open: boolean;\n  setOpen: (open: boolean) => void;\n  titleId: string;\n  descriptionId: string;\n  triggerRef: React.RefObject<HTMLElement | null>;\n};\n\nconst DialogContext = React.createContext<DialogContextValue | null>(null);\n\nconst focusableSelector = [\n  \"button:not([disabled])\",\n  \"[href]\",\n  \"input:not([disabled])\",\n  \"select:not([disabled])\",\n  \"textarea:not([disabled])\",\n  '[tabindex]:not([tabindex=\"-1\"])',\n].join(\", \");\n\nconst closers: Array<() => void> = [];\nlet scrollLocks = 0;\nlet previousOverflow = \"\";\n\nfunction assignRef(\n  ref: React.Ref<HTMLElement> | undefined,\n  node: HTMLElement | null,\n) {\n  if (typeof ref === \"function\") {\n    ref(node);\n    return;\n  }\n\n  if (ref) {\n    ref.current = node;\n  }\n}\n\nfunction reducedMotion() {\n  return (\n    typeof window.matchMedia === \"function\" &&\n    window.matchMedia(\"(prefers-reduced-motion: reduce)\").matches\n  );\n}\n\nfunction lockScroll() {\n  if (scrollLocks === 0) {\n    previousOverflow = document.body.style.overflow;\n    document.body.style.overflow = \"hidden\";\n  }\n\n  scrollLocks += 1;\n}\n\nfunction unlockScroll() {\n  scrollLocks = Math.max(0, scrollLocks - 1);\n\n  if (scrollLocks === 0) {\n    document.body.style.overflow = previousOverflow;\n  }\n}\n\nfunction useDialog() {\n  const context = useContext(DialogContext);\n\n  if (!context) {\n    throw new Error(\"Dialog components must render inside Dialog.\");\n  }\n\n  return context;\n}\n\nexport function Dialog({\n  children,\n  open,\n  defaultOpen = false,\n  onOpenChange,\n}: {\n  children: React.ReactNode;\n  open?: boolean;\n  defaultOpen?: boolean;\n  onOpenChange?: (open: boolean) => void;\n}) {\n  const [uncontrolled, setUncontrolled] = useState(defaultOpen);\n  const isControlled = open !== undefined;\n  const isOpen = isControlled ? open : uncontrolled;\n  const triggerRef = useRef<HTMLElement>(null);\n  const titleId = useId();\n  const descriptionId = useId();\n  const setOpen = useCallback(\n    (next: boolean) => {\n      if (!isControlled) {\n        setUncontrolled(next);\n      }\n\n      onOpenChange?.(next);\n\n      if (!next) {\n        triggerRef.current?.focus();\n      }\n    },\n    [isControlled, onOpenChange],\n  );\n\n  return (\n    <DialogContext.Provider\n      value={{\n        open: isOpen,\n        setOpen,\n        titleId,\n        descriptionId,\n        triggerRef,\n      }}\n    >\n      {children}\n    </DialogContext.Provider>\n  );\n}\n\ntype TriggerElementProps = React.HTMLAttributes<HTMLElement> & {\n  ref?: React.Ref<HTMLElement>;\n};\n\nexport function DialogTrigger({\n  children,\n}: {\n  children: React.ReactElement<TriggerElementProps>;\n}) {\n  const { open, setOpen, triggerRef } = useDialog();\n\n  return React.cloneElement(children, {\n    \"aria-haspopup\": \"dialog\",\n    \"aria-expanded\": open,\n    ref: (node: HTMLElement | null) => {\n      triggerRef.current = node;\n      assignRef(children.props.ref, node);\n    },\n    onClick: (event: React.MouseEvent<HTMLElement>) => {\n      children.props.onClick?.(event);\n\n      if (!event.defaultPrevented) {\n        setOpen(true);\n      }\n    },\n  });\n}\n\nexport function DialogContent({\n  className,\n  children,\n  ...props\n}: React.HTMLAttributes<HTMLDivElement>) {\n  const { open, setOpen, titleId, descriptionId } = useDialog();\n  const contentRef = useRef<HTMLDivElement>(null);\n  const [present, setPresent] = useState(open);\n  const [exiting, setExiting] = useState(false);\n\n  useEffect(() => {\n    if (open) {\n      const timeout = window.setTimeout(() => {\n        setPresent(true);\n        setExiting(false);\n      }, 0);\n\n      return () => window.clearTimeout(timeout);\n    }\n\n    const hide = window.setTimeout(\n      () => {\n        setPresent(false);\n        setExiting(false);\n      },\n      reducedMotion() ? 0 : 160,\n    );\n    const mark = window.setTimeout(() => setExiting(true), 0);\n\n    return () => {\n      window.clearTimeout(hide);\n      window.clearTimeout(mark);\n    };\n  }, [open]);\n\n  useEffect(() => {\n    if (!open) {\n      return;\n    }\n\n    lockScroll();\n    const close = () => setOpen(false);\n    closers.push(close);\n\n    function onKey(event: KeyboardEvent) {\n      if (event.key === \"Escape\" && closers[closers.length - 1] === close) {\n        event.preventDefault();\n        close();\n      }\n    }\n\n    document.addEventListener(\"keydown\", onKey);\n\n    return () => {\n      document.removeEventListener(\"keydown\", onKey);\n      const index = closers.indexOf(close);\n\n      if (index >= 0) {\n        closers.splice(index, 1);\n      }\n\n      unlockScroll();\n    };\n  }, [open, setOpen]);\n\n  useEffect(() => {\n    if (!open || !present) {\n      return;\n    }\n\n    const node = contentRef.current;\n\n    if (!node) {\n      return;\n    }\n\n    const first = node.querySelector<HTMLElement>(focusableSelector);\n\n    if (first) {\n      first.focus();\n      return;\n    }\n\n    node.focus();\n  }, [open, present]);\n\n  if (!present || typeof document === \"undefined\") {\n    return null;\n  }\n\n  return createPortal(\n    <div className=\"fixed inset-0 z-50 flex items-center justify-center p-4\">\n      <div\n        data-dialog-overlay=\"\"\n        className=\"absolute inset-0 bg-black/50\"\n        onClick={() => setOpen(false)}\n      />\n      <div\n        {...props}\n        ref={contentRef}\n        role=\"dialog\"\n        aria-modal=\"true\"\n        aria-labelledby={titleId}\n        aria-describedby={descriptionId}\n        tabIndex={-1}\n        data-dialog-content=\"\"\n        data-state={exiting ? \"closed\" : \"open\"}\n        className={cn(\n          \"border-border bg-background text-foreground relative z-10 flex max-h-[min(32rem,calc(100dvh-2rem))] w-full max-w-[calc(100%-2rem)] flex-col gap-4 overflow-y-auto rounded-lg border p-6 shadow-lg sm:max-w-lg\",\n          exiting ? \"vinyaas-dialog-out\" : \"vinyaas-dialog-in\",\n          className,\n        )}\n        onClick={(event) => event.stopPropagation()}\n        onKeyDown={(event) => {\n          if (event.key !== \"Tab\") {\n            return;\n          }\n\n          const nodes = [\n            ...event.currentTarget.querySelectorAll<HTMLElement>(\n              focusableSelector,\n            ),\n          ];\n          const first = nodes[0];\n          const last = nodes[nodes.length - 1];\n\n          if (!first || !last) {\n            event.preventDefault();\n            return;\n          }\n\n          if (event.shiftKey && document.activeElement === first) {\n            event.preventDefault();\n            last.focus();\n          } else if (!event.shiftKey && document.activeElement === last) {\n            event.preventDefault();\n            first.focus();\n          }\n        }}\n      >\n        {children}\n      </div>\n    </div>,\n    document.body,\n  );\n}\n\nexport function DialogHeader({\n  className,\n  ...props\n}: React.HTMLAttributes<HTMLElement>) {\n  return (\n    <header\n      className={cn(\"flex flex-col gap-2 text-center sm:text-left\", className)}\n      {...props}\n    />\n  );\n}\n\nexport function DialogFooter({\n  className,\n  ...props\n}: React.HTMLAttributes<HTMLElement>) {\n  return (\n    <footer\n      className={cn(\n        \"flex flex-col-reverse gap-2 sm:flex-row sm:justify-end\",\n        className,\n      )}\n      {...props}\n    />\n  );\n}\n\nexport function DialogTitle({\n  className,\n  ...props\n}: React.HTMLAttributes<HTMLParagraphElement>) {\n  const { titleId } = useDialog();\n\n  return (\n    <p\n      id={titleId}\n      className={cn(\"text-lg leading-none font-semibold\", className)}\n      {...props}\n    />\n  );\n}\n\nexport function DialogDescription({\n  className,\n  ...props\n}: React.HTMLAttributes<HTMLParagraphElement>) {\n  const { descriptionId } = useDialog();\n\n  return (\n    <p\n      id={descriptionId}\n      className={cn(\"text-muted-foreground text-sm\", className)}\n      {...props}\n    />\n  );\n}\n\nexport function DialogClose({\n  children,\n}: {\n  children: React.ReactElement<TriggerElementProps>;\n}) {\n  const { setOpen } = useDialog();\n\n  return React.cloneElement(children, {\n    onClick: (event: React.MouseEvent<HTMLElement>) => {\n      children.props.onClick?.(event);\n\n      if (!event.defaultPrevented) {\n        setOpen(false);\n      }\n    },\n  });\n}\n",
      "type": "registry:ui"
    },
    {
      "path": "ui/dialog/dialog.css",
      "content": "@keyframes vinyaas-dialog-in {\n  from {\n    opacity: 0;\n    transform: scale(0.98);\n  }\n  to {\n    opacity: 1;\n    transform: none;\n  }\n}\n\n@keyframes vinyaas-dialog-out {\n  from {\n    opacity: 1;\n    transform: none;\n  }\n  to {\n    opacity: 0;\n    transform: scale(0.98);\n  }\n}\n\n.vinyaas-dialog-in {\n  animation: vinyaas-dialog-in 160ms ease-out;\n}\n\n.vinyaas-dialog-out {\n  animation: vinyaas-dialog-out 160ms ease-in forwards;\n}\n\n@media (prefers-reduced-motion: reduce) {\n  .vinyaas-dialog-in,\n  .vinyaas-dialog-out {\n    animation: none;\n  }\n}\n",
      "type": "registry:ui"
    }
  ],
  "docs": "https://vinyaas.vercel.app/components/dialog",
  "category": "feedback"
}
